Punto,Lat,Lon,
ESCUELA PRIMARIA FRANCISCO GONZALEZ BOCANEGRA,19.4392312,-99.1402335,
ESCUELA PRIMARIA FRANCISCO HERNANDEZ MERCADO,19.5429494,-99.1316138,
ESCUELA PRIMARÍA FRANCISCO I MADERO,19.2183748,-99.2056364,
ESCUELA PRIMARIA FRANCISCO J. MUJICA,19.4975053,-99.2041204,
ESCUELA PRIMARIA FRANCISCO JAVIER LILLY HUERTA,19.3174323,-99.1056366,
ESCUELA PRIMARIA FRANCISCO JAVIER MINA,19.4750739,-99.2053472,
ESCUELA PRIMARIA FRANCISCO MEDINA ASCENCIO,19.4539159,-99.1366713,
ESCUELA PRIMARIA FRANCISCO SANTOYO MALDONADO,19.4522521,-99.1817686,
ESCUELA PRIMARIA FRANCISCO SARABIA,19.4572109,-99.1759775,
ESCUELA PRIMARIA FRANCISCO SARABIA Y TINOCO,19.4302933,-99.0910284,
ESCUELA PRIMARIA FRANCISCO SOSA,19.3164989,-99.0721661,
ESCUELA PRIMARIA FRANCISCO VILLA,19.3396495,-99.0610248,
ESCUELA PRIMARIA FRAY ANTONIO MARGIL DE JESUS,19.3408369,-99.1639539,
ESCUELA PRIMARIA FRAY BARTOLOME DE LAS CASAS,19.3769868,-99.1103983,
ESCUELA PRIMARIA FRAY BARTOLOMÉ DE LAS CASAS,19.4414663,-99.1498713,
ESCUELA PRIMARIA FRAY EUSEBIO KINO,19.3366043,-99.1396941,
ESCUELA PRIMARIA FRAY FRANCISCO APARICIO,19.4474659,-99.1758348,
ESCUELA PRIMARIA FRAY LUIS DE LEON,19.4422628,-99.1464875,
ESCUELA PRIMARIA FRAY MELCHO DE TALAMANTES,19.4374390,-99.1213003,
ESCUELA PRIMARIA FUERZAS ARMADAS DE MEXICO,19.2780318,-99.1623821,
ESCUELA PRIMARIA GABRIEL LEYVA LOZANO,19.4565488,-99.1329236,
ESCUELA PRIMARIA GAMBIA CT 09-DPR2-2-25I  35-1405-343-0-0-X-019 TC,19.3157932,-99.2496588,
ESCUELA PRIMARIA GAUDENCIO PERAZA,19.3489507,-98.9895362,
ESCUELA PRIMARIA GENARO GARCIA CCT 09DPR4155R.,19.3111327,-99.0736262,
ESCUELA PRIMARIA GENERACION 21 22,19.4746760,-99.1350683,
ESCUELA PRIMARIA GENERAL ANAYA,19.3725472,-99.1405273,
ESCUELA PRIMARIA GENERAL CÉSAR LÓPEZ DE LARA,19.4800042,-99.2117611,
ESCUELA PRIMARIA GENERAL DONATO GUERRA 09DPR5017W  DIRECTOR GAUDENCIO GUERRERO JAIMES,19.2836196,-99.1854402,
ESCUELA PRIMARIA GENERAL FRANCISCO MENENDEZ,19.3923340,-99.1842028,
ESCUELA PRIMARIA GENERAL IGNACIO ZARAGOA,19.4498817,-99.1860378,
ESCUELA PRIMARIA GENERAL JUAN N ALVAREZ,19.3341342,-99.2012117,
ESCUELA PRIMARIA GENERAL LAZARO CARDENAS,19.4949164,-99.1479705,
ESCUELA PRIMARIA GENERAL LAZARO CARDENAS DEL RIO,19.2975068,-99.1401938,
ESCUELA PRIMARIA GENERAL LUCIO BLANCO,19.3634452,-99.0185018,
ESCUELA PRIMARIA GENERAL MIGUEL ALEMAN,19.4426194,-99.1225760,
ESCUELA PRIMARIA GENERAL PEDRO A OGAZON,19.4562406,-99.1963394,
ESCUELA PRIMARIA GENERAL PEDRO OGAZON 211050-252-00-X-016,19.4670406,-99.0692227,
ESCUELA PRIMARIA GENERAL PLUTARCO ELIAS CALLES,19.4450655,-99.2183164,
ESCUELA PRIMARIA GENERAL SANTOS DE GOLLADO,19.3308869,-99.3262244,
ESCUELA PRIMARIA GENERAL VICENTE GUERRERO,19.4905262,-99.1047859,
ESCUELA PRIMARIA GENOVEVA CORTEZ,19.3348183,-99.0421473,
ESCUELA PRIMARIA GENOVEVA CORTEZ VALLADARES,19.4469563,-99.1701124,
ESCUELA PRIMARIA GEORGES CUISENAIRE,19.4974325,-99.1826452,
ESCUELA PRIMARIA GERTRUDIS ARMENDARIS DE HIDALGO,19.5410135,-99.1416144,
ESCUELA PRIMARIA GRAL FELIPE ANGELES,19.4467570,-99.1117532,
ESCUELA PRIMARIA GRAL FRANCISCO J MUJICA,19.4215789,-99.0717424,
ESCUELA PRIMARIA GRAL HERIBERTO JARA,19.5642936,-99.1386169,
ESCUELA PRIMARIA GRAL J FERNANDO RAMIREZ,19.4531674,-99.2114208,
ESCUELA PRIMARIA GRAL JOSE MARIANO MONTERDE,19.2655754,-99.1451038,
ESCUELA PRIMARIA GRAL JUAN ALVAREZ 09DPR1932F,19.3334074,-99.2013735,
ESCUELA PRIMARIA GRAL LAZARO CARDENAS DEL RIO,19.2974707,-99.1400983,
ESCUELA PRIMARIA GRAL MIGUEL NEGRETE,19.4993699,-99.0864374,
ESCUELA PRIMARIA GRECIA,19.2729262,-99.1400120,
ESCUELA PRIMARIA GREGORIO TORRES QUINTERO,19.5532944,-99.1405135,
ESCUELA PRIMARIA GUADALUPE FLORES ALONSO,19.3172982,-99.2396344,
ESCUELA PRIMARIA GUILLEN DE LAMPART,19.3102100,-99.1703300,
ESCUELA PRIMARIA GUILLERMO BONILLA SEGURA,19.3845749,-99.0644532,
ESCUELA PRIMARIA GUILLERMO SHERWELL,19.3137475,-99.1154341,
ESCUELA PRIMARIA GUSTAVO A MADERO,19.3380110,-99.1086856,
ESCUELA PRIMARIA GUZTAVO A MADERO,19.3377326,-99.1081205,
ESCUELA PRIMARIA HERMANOS FLORES MAGON,19.3427350,-98.9992750,
ESCUELA PRIMARIA HERMANOS GALEANA,19.3588796,-99.2531453,
ESCUELA PRIMARIA HERMANOS SERDAN,19.3448597,-99.0127640,
ESCUELA PRIMARIA HEROE ANTONIO REYESJORNADA AMPLIADA,19.4777446,-99.0807356,
ESCUELA PRIMARIA HEROES DE 1914,19.4250910,-99.0961302,
ESCUELA PRIMARIA HEROES DE CERRO PRIETO E09DPR1092B,19.4544542,-99.0969354,
ESCUELA PRIMARIA HEROES DE CHAPULTEPEC,19.2751531,-99.1715266,
ESCUELA PRIMARIA HEROES DE CHURUBUSCO,19.3494024,-99.1561074,
ESCUELA PRIMARIA HEROES DE LA INDEPENDENCIA,19.2757011,-99.1381086,
ESCUELA PRIMARIA HEROES DEL MOLINO CCT09DPR1086R,19.3991771,-99.0567107,
ESCUELA PRIMARIA HEROICA VERACRUZ JORNADA AMPLIADA,19.4875421,-99.0892902,
ESCUELA PRIMARIA HEROICOS CADETES,19.3817161,-99.1255059,
ESCUELA PRIMARIA HIDROELECTRICA DE CUPATITZIO JORNADA AMPLIADA,19.4878488,-99.0858865,
ESCUELA PRIMARIA HIMNO NACIONAL MEXICANO SEP,19.3705917,-99.1136903,
ESCUELA PRIMARIA HOLANDA,19.3534855,-99.1116509,
ESCUELA PRIMARIA HOLANDA. CLAVE DE CENTRO DE TRABAJO 09DPR1286P,19.3533510,-99.1116640,
ESCUELA PRIMARIA HORACIO MANN,19.4256051,-99.1554306,
ESCUELA PRIMARIA HUMBERTO ESPARZA VILLAREAL,19.2638918,-99.1193981,
ESCUELA PRIMARIA IDEARIO DE JUAREZ,19.3178764,-99.1570266,
ESCUELA PRIMARIA IGNACIO ALLENDE,19.4564699,-99.1218154,
ESCUELA PRIMARIA IGNACIO GONZALEZ GUZMAN 09DPR2606Q,19.3538601,-99.0516923,
ESCUELA PRIMARIA IGNACIO LOPEZ RAYON,19.3976551,-99.1940292,
ESCUELA PRIMARIA IGNACIO MANUEL ALTAMIRANO 09DPR5103S,19.3421273,-99.0280287,
ESCUELA PRIMARIA IGNACIO MARISCAL,19.4564640,-99.0549530,
ESCUELA PRIMARIA IGNACIO RAMIREZ,19.2563045,-99.1071409,
ESCUELA PRIMARIA IGNACIO RODRIGUEZ GALVAN,19.2874451,-99.1651806,
ESCUELA PRIMARIA IGNACIO ZARAGOZA,19.3920914,-99.0895680,
ESCUELA PRIMARIA INDEPENDENCIA ECONÓMICA DE MEXICO,19.2562849,-99.0648136,
ESCUELA PRIMARIA INDIRA GANDHI CCT 09DPR4006J,19.2904044,-99.2216715,
ESCUELA PRIMARIA ING JUAN DE DIOS BATIZ T V,19.5248988,-99.1456895,
ESCUELA PRIMARIA ING ROBERTO GAYOL CCT 09DPR1216U,19.3107092,-99.0712005,
ESCUELA PRIMARIA ING. GONZALEZ CAMARENA,19.4852505,-99.1805171,
ESCUELA PRIMARIA ING. MIGUEL BERNARD,19.2524973,-99.0568412,
ESCUELA PRIMARIA INGENIERO JAVIER BARROS SIERRA,19.3368916,-99.2381362,
ESCUELA PRIMARIA INSURGENTE MORELOS JORNADA AMPLIADA,19.4860278,-99.1141941,
ESCUELA PRIMARIA INSURGENTE PEDRO MORENO,19.3900232,-99.0511633,
ESCUELA PRIMARIA INTERNADO NO 28 GENERAL LAZARO CARDENAS,19.3666668,-99.0940829,
ESCUELA PRIMARIA INVESTIGACION EDUCATIVA,19.3705430,-99.2803862,
ESCUELA PRIMARIA ISAC NEWTON,19.3745597,-99.0365836,
ESCUELA PRIMARIA ITALIA,19.4486335,-99.1422784,
ESCUELA PRIMARIA J. CONCEPCION RIVERA CCT09DPR0113R,19.3564526,-99.0311907,
ESCUELA PRIMARIA JACINTO CANEK CCT 09DPR1863Z,19.2885613,-99.2189914,
ESCUELA PRIMARIA JAIME SABINES,19.3042554,-99.0397252,
ESCUELA PRIMARIA JAIME TORRES BODET,19.4582120,-99.1086395,
ESCUELA PRIMARIA JAPON,19.3661892,-99.1185123,
ESCUELA PRIMARIA JERONIMO FIGUEROA,19.5211330,-99.1532091,
ESCUELA PRIMARIA JESUS CARLOS ROMERO VILLA,19.5088554,-99.1247557,
ESCUELA PRIMARIA JESUS MASTACHE ROMAN,19.3829900,-99.1139016,
ESCUELA PRIMARIA JESUS NARVAEZ GALDEANO 09DPR4509B,19.3297872,-99.0584466,
ESCUELA PRIMARIA JESUS ROMERO FLORES,19.4752642,-99.1285338,
ESCUELA PRIMARIA JESUS SOTELO INCLAN,19.5066953,-99.1899262,
ESCUELA PRIMARIA JESUS T ACEVEDO,19.3877952,-99.0602198,
ESCUELA PRIMARIA JOAQUIN BARANDAS,19.4582553,-99.1887761,
ESCUELA PRIMARIA JONAS EDWARD SALK,19.3845755,-99.1413369,
ESCUELA PRIMARIA JORGE ALACIO PEREZ,19.3715797,-99.1329447,
ESCUELA PRIMARIA JORGE CASAHONDA CASTILLO,19.5498972,-99.1419048,
ESCUELA PRIMARIA JORNADA AMPLIADA PROFESOR ANTONIO BARBOSA HELDT 09DPRI208L,19.3693502,-99.1299835,
ESCUELA PRIMARIA JOSE ARTURO PICHARDO,19.4677850,-99.1885514,
ESCUELA PRIMARIA JOSE AZUETA,19.2888240,-99.1761651,
ESCUELA PRIMARIA JOSE DE JESUS IBARRA Y ROBLES,19.3919637,-99.2126490,
ESCUELA PRIMARIA JOSE DOLORES MEDINA DELGADO,19.3865256,-99.0493041,
ESCUELA PRIMARIA JOSE INES NOVELO,19.3682279,-99.2324297,
ESCUELA PRIMARIA JOSÉ JESÚS AGUILERA PALOMINO 09DPR4184M JORNADA AMPLIADA,19.3310334,-99.1721908,
ESCUELA PRIMARIA JOSE LOPEZ ALAVEZ,19.5094471,-99.0979763,
ESCUELA PRIMARIA JOSE LOPEZ PORTILLO Y ROJAS,19.4141490,-99.0605705,
ESCUELA PRIMARIA JOSE LUIS VIEYRA GONZALEZ,19.3532711,-99.2959416,
ESCUELA PRIMARIA JOSÉ MA RODRÍGUEZ COS,19.3282485,-99.0442620,
ESCUELA PRIMARIA JOSE MARIA CHAVEZ ANDRADE CCT. 09DPR5100V,19.2684873,-99.2120379,
ESCUELA PRIMARIA JOSE MARIA IGLESIAS,19.4176384,-99.1700182,
ESCUELA PRIMARIA JOSE MARIA MATA,19.3998637,-99.1623651,
ESCUELA PRIMARIA JOSE MARIA MORELOS,19.1952037,-99.0267577,
ESCUELA PRIMARIA JOSE MARIA MORELOSTURNO,19.1951985,-99.0267583,
ESCUELA PRIMARIA JOSE MARIA TAPIA FREYDING,19.3571422,-99.2545264,
ESCUELA PRIMARIA JOSE MARIANO PONTON,19.4159471,-99.0860255,
ESCUELA PRIMARIA JOSE MARTI,19.3994519,-99.1640377,
ESCUELA PRIMARIA JOSE REVUELTAS,19.5208613,-99.1315314,
ESCUELA PRIMARIA JOSE RUBEN ROMERO,19.4153084,-99.0584942,
ESCUELA PRIMARIA JOSE VASCONCELOS TIEMPO COMPLETO,19.3422285,-99.0592870,
ESCUELA PRIMARIA JOSE VICENTE VILLADA CCT09DPR1431K,19.4529643,-99.0695856,
ESCUELA PRIMARIA JOSEFA ORTIZ DE DOMINGUEZ,19.3294514,-99.2125754,
ESCUELA PRIMARIA JOSEFINA RODRIGUEZ SOLIS,19.3807337,-99.2033304,
ESCUELA PRIMARIA JOSEFINA TOLSA MARAÑON,19.5523871,-99.1348076,
ESCUELA PRIMARIA JUAN AMOS COMENIO,19.4460358,-99.2043148,
ESCUELA PRIMARIA JUAN B TIJERINA,19.3664407,-99.0245976,
ESCUELA PRIMARIA JUAN B ZALAZAR,19.5181979,-99.1541895,
ESCUELA PRIMARIA JUAN BADIANO,19.2612612,-99.1302518,
ESCUELA PRIMARIA JUAN CRISOSTOMO BONILLA,19.4092778,-99.0841297,
ESCUELA PRIMARIA JUAN DE MATA RIVERA.,19.3068750,-99.0671835,
ESCUELA PRIMARIA JUAN ESCUTIA,19.3155108,-99.0794255,
ESCUELA PRIMARIA JUAN JACOBO ROUSSEAU 09DPR2566F,19.4796079,-99.0668302,
ESCUELA PRIMARIA JUAN MOTALVO,19.3929331,-99.1356575,
ESCUELA PRIMARIA JUAN PABLO GALEANA,19.5769766,-99.1329261,
ESCUELA PRIMARIA JUAN RAMON JIMENEZ CCT09DPR2821G,19.3069945,-99.0803094,
ESCUELA PRIMARIA JUAN RODRIGUEZ PUEBLA,19.3776167,-99.0160205,
ESCUELA PRIMARIA JUAN RULFO,19.3685371,-99.0355850,
ESCUELA PRIMARIA JUANA DE ASBAJE,19.4908654,-99.1094311,
ESCUELA PRIMARIA JUANA DE ASBAJE DE TIEMPO COMPLETO,19.3670913,-99.1115673,
ESCUELA PRIMARIA JUANA PAVON DE MORELOS,19.3613006,-99.1146856,
ESCUELA PRIMARIA JULIAN ADAME A LA TORRE,19.3516690,-99.1619076,
ESCUELA PRIMARIA JULIO DE LA FUENTE,19.2873051,-99.0610026,
ESCUELA PRIMARIA JULIO VERNE,19.4909223,-99.2080430,
ESCUELA PRIMARIA JULIO ZARATE,19.4404531,-99.1194115,
ESCUELA PRIMARIA JUSTINA GONZALEZ MARTINEZ 24-0659-210-00-X-016 09DPR3012N,19.5236677,-99.1386970,
ESCUELA PRIMARIA JUSTO SIERRA 09DPR515,19.3072777,-99.3345346,
ESCUELA PRIMARIA JUSTO SIERRA COMPLETO,19.4843722,-99.2138667,
ESCUELA PRIMARIA JUVENTINO ROSAS,19.5597859,-99.1318665,
ESCUELA PRIMARIA KOWEIT,19.4973607,-99.0759291,
ESCUELA PRIMARIA KULKULKAN,19.4837533,-99.0853375,
ESCUELA PRIMARIA LA PRADERA 09DPR1402P,19.4785361,-99.0674474,
ESCUELA PRIMARIA LA PRENSA CCT 09DPR1404N,19.4663683,-99.1295626,
ESCUELA PRIMARIA LA RAZA,19.4650364,-99.1468773,
ESCUELA PRIMARIA LAS TRES AMERICAS,19.4301718,-99.1643052,
ESCUELA PRIMARIA LAURA MENDEZ DE CUENCA,19.3716672,-99.2125434,
ESCUELA PRIMARIA LAUREANO JIMENEZ Y CORIA,19.5131891,-99.1414339,
ESCUELA PRIMARIA LAUREANO JIMENEZ Y CORIA CLAVE 210660211X016,19.5127881,-99.1411352,
ESCUELA PRIMARIA LAZARO PAVIA 09DPR42160,19.2983443,-99.2230955,
ESCUELA PRIMARIA LEANDRO VALLE,19.3772497,-99.0699537,
ESCUELA PRIMARIA LEGION AMERICANA,19.2338600,-99.1821940,
ESCUELA PRIMARIA LEON GUZMAN DISCONTINUO,19.4163914,-99.1139451,
ESCUELA PRIMARIA LEONA VICARIO,19.3880790,-99.2588121,
ESCUELA PRIMARIA LEONARDO BRAVO,19.4611184,-99.1276511,
ESCUELA PRIMARIA LEONISMO INTERNACIONAL,19.3983670,-99.1426698,
ESCUELA PRIMARIA LEOPOLDO KIEL 09DPR2109S,19.3904236,-99.0411589,
ESCUELA PRIMARIA LEOPOLDO VELAZQUEZ ACUÑA 09DPR5093B,19.3611341,-99.0757832,
ESCUELA PRIMARIA LEYES DE REFORMA,19.4635161,-99.1499176,
ESCUELA PRIMARIA LEYES DE REFORMA DEL 57,19.2259632,-99.2009402,
ESCUELA PRIMARIA LIBERACION CAMPESINA,19.4908595,-99.2084488,
ESCUELA PRIMARIA LIBERAL,19.3212212,-99.1467296,
ESCUELA PRIMARIA LIBERTADORES DE MEXICO,19.4572822,-99.1047894,
ESCUELA PRIMARIA LIC ALFREDO V BONFIL PINTO,19.4976439,-99.0786982,
ESCUELA PRIMARIA LIC CARLOS ZAPATA VELA,19.3939079,-99.1057383,
ESCUELA PRIMARIA LIC JOSE LOPEZ PORTILLO Y ROJAS,19.5605329,-99.1315973,
ESCUELA PRIMARIA LIC JULIO JIMENEZ RUEDA,19.3897841,-99.0662748,
ESCUELA PRIMARIA LIC LAURO G CALOCA 21-0886,19.4871330,-99.1054310,
ESCUELA PRIMARIA LIC PROTASIO TAGLE,19.3514793,-99.1638539,
ESCUELA PRIMARIA LIC. ATENEDORO MONROY CCT09DPR1560E,19.4722316,-99.1519419,
ESCUELA PRIMARIA LIC. MIGUEL ALEMAN,19.1945088,-99.0955953,
ESCUELA PRIMARIA LICENCIADO ALVARO GALVEZ Y FUENTES,19.3865580,-99.1006827,
ESCUELA PRIMARIA LICENCIADO EDUARDO NOVOA,19.3640418,-99.1468320,
ESCUELA PRIMARIA LICENCIADO FERNANDO CASAS ALEMAN,19.4478832,-99.0920003,
ESCUELA PRIMARIA LIDICE,19.3259736,-99.2249087,
ESCUELA PRIMARIA LINAJE AZTECA,19.2827073,-99.0554333,
ESCUELA PRIMARIA LISANDRO CALDERON,19.4608061,-99.1267363,
ESCUELA PRIMARIA LORENZA ROSALES,19.4486918,-99.1252784,
ESCUELA PRIMARIA LORENZO PEDRERO PADILLA,19.4988784,-99.1499059,
ESCUELA PRIMARIA LUCAS ORTÍZ BENITEZJORNADA AMPLIADA,19.5314869,-99.1470245,
ESCUELA PRIMARIA LUCIO CABAÑAS,19.3214055,-99.0397660,
ESCUELA PRIMARIA LUCIO TAPIA,19.4462540,-99.1305020,
ESCUELA PRIMARIA LUIS AUDIRAC GALVEZ,19.3760146,-99.2336453,
ESCUELA PRIMARIA LUIS BRAILE,19.3383420,-98.9794486,
ESCUELA PRIMARIA LUIS CABRERA,19.4127723,-99.1149126,
ESCUELA PRIMARIA LUIS CASTILLO LEDON,19.4485087,-99.2018753,
ESCUELA PRIMARIA LUIS DE LA BRENA,19.2350114,-99.1634295,
ESCUELA PRIMARIA LUIS DE LA ROSA COMPLETO,19.4382892,-99.1218403,
ESCUELA PRIMARIA LUIS G LOZANO,19.4699677,-99.0993936,
ESCUELA PRIMARIA LUIS G. LEON,19.4477645,-99.1324934,
ESCUELA PRIMARIA LUIS GONZALEZ OBREGON,19.4019181,-99.1585040,
ESCUELA PRIMARIA LUIS MARTINEZ MURILLO JORNADA AMPLIADA CLAVE 09DPR1379E,19.4720978,-99.0754457,
ESCUELA PRIMARIA LUIS MURILLO,19.4402752,-99.1366335,
ESCUELA PRIMARIA LUIS PENICHE VALLADO,19.3122259,-99.0379718,
ESCUELA PRIMARIA LUIS R ALARCON,19.3659576,-99.1974347,
ESCUELA PRIMARIA LUIS VARGAS PIÑEIRA,19.3866842,-99.0492113,
ESCUELA PRIMARIA LUXEMBURGO,19.3692043,-99.1970762,
ESCUELA PRIMARIA MA ENRIQUETA CAMARILLO,19.3640908,-99.0024160,
ESCUELA PRIMARIA MA MAGDALENA PACHECO BLANCO,19.2965670,-99.0625174,
ESCUELA PRIMARIA MACUILXOCHITZIN,19.3283899,-99.0271173,
ESCUELA PRIMARIA MADRE MEXICANA,19.3273903,-99.2844788,
ESCUELA PRIMARIA MAESTRA GABRIELA MISTRAL,19.3144041,-99.1614574,
ESCUELA PRIMARIA MAESTRO ADOLFO VALLES,19.2270244,-99.1078248,
ESCUELA PRIMARIA MAESTRO ARQUELES VELA SALVATIERRA,19.3904870,-99.2014202,
ESCUELA PRIMARIA MAESTRO CARLOS GONZALEZ PEÑA,19.4616764,-99.1128446,
ESCUELA PRIMARIA MAESTRO ERNESTO ALCONEDO,19.3771835,-99.1714240,
ESCUELA PRIMARIA MAESTRO FEDERICO ALVAREZ,19.3902067,-99.1465535,
ESCUELA PRIMARIA MAESTRO JOSE HELIODORO BRAVO,19.4587398,-99.0896268,
ESCUELA PRIMARIA MAESTRO JOSE VASCONCELOS JORNADA AMPLIA CCT 09DPR1665Z,19.4615903,-99.1635114,
ESCUELA PRIMARIA MAESTRO JULIAN CARRILLO CON INJESTA COMPLETO,19.4606858,-99.1324946,
ESCUELA PRIMARIA MAESTRO JULIO GARCIA,19.4790802,-99.1910437,
ESCUELA PRIMARIA MAESTRO LAURO AGUIRRE,19.4391525,-99.0840777,
ESCUELA PRIMARIA MAESTRO LEOPOLDO GARCIA VEYRAN,19.3943087,-99.2033401,
ESCUELA PRIMARIA MAESTRO LUIS CHAVEZ OROZCO,19.3900308,-99.0946015,
ESCUELA PRIMARIA MAESTROS DE MEXICO,19.3913137,-99.1036329,
ESCUELA PRIMARIA MAHATMA GANDHI22-0860-26414X-016,19.4862466,-99.0778271,
ESCUELA PRIMARIA MALIA GONZALEZ CABALLERO DE TIEMPO COMPLETO,19.5112866,-99.2019562,
ESCUELA PRIMARIA MANUEL ACUÑA,19.3701035,-99.2853049,
ESCUELA PRIMARIA MANUEL BONETA MENDEZ,19.4847494,-99.0711877,
ESCUELA PRIMARIA MANUEL BUENDÍA,19.3901850,-99.1229690,
ESCUELA PRIMARIA MANUEL C TELLO,19.4671836,-99.0770141,
ESCUELA PRIMARIA MANUEL GALLARDO ZAMORA,19.2723877,-99.1769221,
ESCUELA PRIMARIA MANUEL GAMIO,19.3624073,-99.0113099,
ESCUELA PRIMARIA MANUEL GONZALEZ FLORES,19.3373501,-99.0138469,
ESCUELA PRIMARIA MANUEL GUTIERREZ NAJERA,19.5006722,-99.0859547,
ESCUELA PRIMARIA MANUEL LOPEZ COTILLA,19.4194104,-99.1663076,
ESCUELA PRIMARIA MANUEL M. ACOSTA,19.4468557,-99.1700452,
ESCUELA PRIMARIA MANUEL QUIROZ MARTINEZ CCT 09DPR2300Z AMPLIADO,19.3859626,-99.2017030,
ESCUELA PRIMARIA MANUEL RIVERA CAMBAS,19.3296250,-99.0200307,
ESCUELA PRIMARIA MANUEL RUIZ RODRIGUEZ JORNADA AMPLIADA,19.4888849,-99.0840567,
ESCUELA PRIMARIA MANUEL SABINO CRESPO,19.5523534,-99.1517862,
ESCUELA PRIMARIA MAO TSE TUNG,19.3835831,-99.1134262,
ESCUELA PRIMARIA MARCDELINO HERNANDEZ ESPINOSA. COMPLETO,19.4147634,-99.1177276,
ESCUELA PRIMARIA MARCELIANO TREJO SANTA ANA,19.2817724,-99.1194124,
ESCUELA PRIMARIA MARCELINO DAVALOS,19.4336863,-99.1287762,
ESCUELA PRIMARIA MARCELINO RENTERIA,19.3265925,-99.0536787,
ESCUELA PRIMARIA MARGARITA DE GORTARI DE ZALINAS LOZANO 09DPR4522W,19.4266540,-99.0591999,
ESCUELA PRIMARIA MARGARITA MAGON DE FLORES,19.2449020,-99.0973086,
ESCUELA PRIMARIA MARGARITA MAZA DE JUAREZ,19.4391942,-99.1595535,
ESCUELA PRIMARIA MARÍA ADELINA FLORES MORALES,19.3250622,-99.2496150,
ESCUELA PRIMARIA MARÍA EPIGMENIA ARRIAGA SALGADO,19.3106642,-99.1041075,
ESCUELA PRIMARIA MARIA PATIÑO VIUDA DE OLMEDO,19.3374601,-99.2263043,
ESCUELA PRIMARIA MARIANO ABASOLO,19.3058217,-99.2336752,
ESCUELA PRIMARIA MARIANO GALVAN RIVERA,19.2680231,-99.1286605,
ESCUELA PRIMARIA MARIO DE LA CUEVA JORNADA AMPLIADA,19.4813725,-99.0889114,
ESCUELA PRIMARIA MARTIN DE LA CRUZ,19.2893347,-99.1280560,
ESCUELA PRIMARIA MARTIN LUIS GUZMAN,19.3007242,-99.2575482,
ESCUELA PRIMARIA MARTIN TORRES PADILLA,19.2857128,-99.1401651,
ESCUELA PRIMARIA MARTINA ISLAS,19.2659210,-99.1676261,
ESCUELA PRIMARIA MARTIRES DE LA REFORMA 09DPR1242S,19.3319831,-99.1090524,
ESCUELA PRIMARIA MARTIRES DE RIO BLANCO,19.4575750,-99.1142485,
ESCUELA PRIMARÍA MARTIRES DE TACUBAYA,19.4120569,-99.1900602,
ESCUELA PRIMARIA MARTIRES DE URUAPAN,19.5253089,-99.1724151,
ESCUELA PRIMARIA MARTIRES DEL AGRARISMO,19.4838285,-99.2004764,
ESCUELA PRIMARIA MAURITANIA,19.1965960,-99.1419965,
ESCUELA PRIMARIA MEDICO BERNARDO SEPULVEDA GUTIERREZ,19.3059343,-99.2668177,
ESCUELA PRIMARIA MELCHOR MUZQUIZ,19.3426406,-99.1913703,
ESCUELA PRIMARIA MELCHOR OCAMPO,19.3501284,-99.1578896,
ESCUELA PRIMARIA MELITON GUZMAN ROMERO,19.4727247,-99.1158856,
ESCUELA PRIMARIA MERCED HIDALGO MONROY DE LA TORRE MATUTINA,19.4911891,-99.1041143,
ESCUELA PRIMARIA MEXICO JAPON,19.3254183,-99.0508586,
ESCUELA PRIMARIA MEXITLI JORNADA AMPLIADA,19.4788970,-99.2086697,
ESCUELA PRIMARIA MI PATRIA ES PRIMERO,19.4855655,-99.2018856,
ESCUELA PRIMARIA MIGUEL ALEMAN,19.3900417,-99.1465742,
ESCUELA PRIMARIA MIGUEL BUSTOS CERECEDO,19.2384459,-99.1490410,
ESCUELA PRIMARIA MIGUEL DE CERVANTES SAAVEDRA,19.3866333,-99.0567531,
ESCUELA PRIMARIA MIGUEL DE UNAMUNO,19.4257352,-99.1595015,
ESCUELA PRIMARIA MIGUEL HIDALGO AMPLIADO CLAVE 15-0973-137-00-X-016,19.4668525,-99.1058764,
ESCUELA PRIMARIA MIGUEL HIDALGO Y COSTILLA,19.1852196,-99.0750591,
ESCUELA PRIMARIA MIGUEL SANCHEZ RIVERA,19.3063215,-99.0674796,
ESCUELA PRIMARIA MITLA 09DPR4514N,19.2907605,-99.0656130,
ESCUELA PRIMARIA MIXCOAC,19.3205328,-99.0589107,
ESCUELA PRIMARIA MOCTEZUMA ILHUICAMINA CCT 09DPR1542P,19.4513604,-99.0745417,
ESCUELA PRIMARIA MOISES SAENZ,19.4833722,-99.0995627,
ESCUELA PRIMARIA MONTES AZULES,19.3924798,-99.1477294,
ESCUELA PRIMARIA MTRA GUADALUPE NUÑEZ Y PARRA,19.4825000,-99.1195380,
ESCUELA PRIMARIA MTRO ENRIQUE C REBSAMEN,19.4975822,-99.0794494,
ESCUELA PRIMARIA MTRO FRANCISCO MONTES DE OCA,19.4081354,-99.1717309,
ESCUELA PRIMARIA MTRO MIGUEL A QUINTANA,19.5008691,-99.1302261,
ESCUELA PRIMARIA MTRO. CAYETANO RODRIGUEZ BELTRAN,19.3886185,-99.2084856,
ESCUELA PRIMARIA MTRO. MANUEL C TELLO 09DPR1363D,19.4678438,-99.0764067,
ESCUELA PRIMARIA MTROENRIQUE CREBSAMEN,19.4977989,-99.0792973,.
ESCUELA PRIMARIA MUJERES INSURGENTES,19.3159254,-99.0889532,
ESCUELA PRIMARIA MURALISTA ALFREDO ZALCE,19.3287793,-99.0797882,
ESCUELA PRIMARIA NACIONES UNIDAS,19.3960851,-99.1864423,
ESCUELA PRIMARIA NEZAHUALCOYOTL,19.3256640,-99.1591887,
ESCUELA PRIMARIA NICOLAS BRAVO,19.4953216,-99.0813388,
ESCUELA PRIMARIA NICOLAS CHAPA NIETO,19.2954728,-99.0294143,
ESCUELA PRIMARIA NICOLAS LEON,19.2853901,-98.9963381,
ESCUELA PRIMARIA NIGER,19.2903182,-99.1237757,
ESCUELA PRIMARIA NIÑO HEROE JOSE LUIS ORDAZ LOPEZ,19.4811488,-99.0762294,
ESCUELA PRIMARIA NIÑO JESUS GUARNEROS,19.4457715,-99.1143962,
ESCUELA PRIMARIA NIÑOS HEROES  311358-30600-X-015,19.3452203,-99.3128261,
ESCUELA PRIMARIA NIÑOS HEROES 09DPR5096Z,19.3226616,-99.0866566,
ESCUELA PRIMARIA NO 4 CLUB DE LEONES,19.3708727,-99.2013237,
ESCUELA PRIMARIA NORMAN E BORLAUG,19.4837080,-99.2132503,
ESCUELA PRIMARIA NORUEGA 09DPR1054Z,19.4238986,-99.1074967,
ESCUELA PRIMARIA NÚMERO 11 EMPERADOR CUITLAHUAC JORNADA AMPLIADA,19.4725535,-99.1711093,
ESCUELA PRIMARIA OBRERO MEXICANO,19.5043113,-99.1740198,
ESCUELA PRIMARIA OCTAVIO PAZ,19.2771801,-99.1183573,
ESCUELA PRIMARIA OROZCO Y BERRA,19.4577452,-99.1794165,
ESCUELA PRIMARIA PABLO MORENO,19.4393572,-99.1326780,
ESCUELA PRIMARIA PABLO PICASSO,19.3365330,-99.0464899,
ESCUELA PRIMARIA PATRIA JORNADA COMPLETA CON INGESTA,19.4805578,-99.0858395,
ESCUELA PRIMARIA PEDAGOGIA,19.3362827,-99.1332218,
ESCUELA PRIMARIA PEDRO ASCENCIO,19.3764727,-99.1485608,
ESCUELA PRIMARIA PEDRO ROMERO DE TERREROS 09DPR1048O,19.4108986,-99.0627756,
ESCUELA PRIMARIA PEDRO ROMERO DE TERREROS 09DPR1230N,19.3758006,-99.1522562,
ESCUELA PRIMARIA PEDRO SAINZ DE BARANDA,19.4151399,-99.1465049,
ESCUELA PRIMARIA PENSADOR MEXICANO,19.4477412,-99.1580171,
ESCUELA PRIMARIA PETROLEOS MEXICANOS,19.4807450,-99.2040156,
ESCUELA PRIMARIA PINTOR DIEGO RIVERA,19.1923380,-99.0893206,
ESCUELA PRIMARIA PLAN DE AYALA,19.2939556,-99.0148614,
ESCUELA PRIMARIA PLAN DE AYUTLA,19.3175093,-99.1421233,
ESCUELA PRIMARIA PLAN DE GUADALUPE,19.2971073,-99.0363398,
ESCUELA PRIMARIA PLAN DE ONCE AÑOS,19.3895365,-99.1211063,
ESCUELA PRIMARIA PLAN DE SAN LUIS,19.3446742,-99.1093561,
ESCUELA PRIMARIA POLONIA,19.4691068,-99.1863147,
ESCUELA PRIMARIA POPOL VUH SEP,19.2330180,-99.0021123,
ESCUELA PRIMARIA PRESIDENTE ADOLFO LOPEZ MATEOS,19.3680691,-99.1033836,
ESCUELA PRIMARIA PRESIDENTE PLUTARCO ELIAS CALLES,19.3907196,-99.1322669,
ESCUELA PRIMARIA PRESIDENTES DE MEXICO,19.4748737,-99.1614147,
ESCUELA PRIMARIA PRIMERO DE MAYO JORNADA AMPLIADA,19.2929108,-99.1720138,
ESCUELA PRIMARIA PROCERES DE LA INDEPENDENCIA JORNADA AMPLIADA,19.3318612,-99.2123422,
ESCUELA PRIMARIA PROCERES DE LA REFORMA,19.3321945,-99.2175543,
ESCUELA PRIMARIA PROCERES DE LA REVOLUCION,19.3346791,-99.2096488,
ESCUELA PRIMARIA PROF AGUSTIN CUE CANOVAS,19.3269660,-99.0798968,
ESCUELA PRIMARIA PROF BEATRIZ DE GORTARI Y PEREZ,19.4679363,-99.0612114,
ESCUELA PRIMARIA PROF CARMEN RAMOS DEL RIO,19.3865813,-99.0524038,
ESCUELA PRIMARIA PROF DANIEL DELGADILLO,19.4784772,-99.0812662,
ESCUELA PRIMARIA PROF JACINTO N CHAGOYA,19.4616226,-99.1349067,
ESCUELA PRIMARIA PROF LUIS GUEVARA RAMIREZ,19.3308354,-99.0742995,
ESCUELA PRIMARIA PROF MANUEL S HIDALGO CASTRO,19.3050755,-99.0415041,
ESCUELA PRIMARIA PROF RAFAEL LOPEZ MAT CCT09DPR2470T,19.3666124,-98.9935449,
ESCUELA PRIMARIA PROF ROBERTO MARTINEZ FLORES,19.5365945,-99.1421029,
ESCUELA PRIMARIA PROF. ABEL ORTEGA,19.2638047,-99.1644036,
ESCUELA PRIMARIA PROF. JOSE SANTOS VALDEZ T.M,19.3182345,-99.0420488,
ESCUELA PRIMARIA PROF. MANUEL RAFAEL GUTIERREZ,19.2890591,-99.0068580,
ESCUELA PRIMARIA PROF. XAVIER MEJIA,19.3044599,-99.1447046,
ESCUELA PRIMARIA PROFE URBANO LAVIN ROMAN,19.2942581,-99.0490376,
ESCUELA PRIMARIA PROFESOR ADOLFO VELAZQUEZ VILCHES,19.3915005,-99.2085136,
ESCUELA PRIMARIA PROFESOR ARNULFO PÉREZ HENÁNADEZ,19.3834280,-99.1121392,
ESCUELA PRIMARIA PROFESOR AVELINO BOLANOS PALACIOS,19.3223108,-99.1156463,
ESCUELA PRIMARIA PROFESOR BRUNO MARTINEZ,19.3299880,-99.0204248,
ESCUELA PRIMARIA PROFESOR CANDIDO JARAMILLO GONZALEZ,19.3376772,-99.1237989,
ESCUELA PRIMARIA PROFESOR CARITINO MALDONADO PEREZ 51-2527-534-X-024,19.2467103,-99.1064353,
ESCUELA PRIMARIA PROFESOR CARLOS FUENTES MARTÍNEZ,19.4798943,-99.0689422,
ESCUELA PRIMARIA PROFESOR CASTULO RAMIREZ LUGO,19.3795227,-99.0186387,
ESCUELA PRIMARIA PROFESOR CECILIO MIJARES POBLANO,19.2723438,-99.2368681,
ESCUELA PRIMARIA PROFESOR CLAUDIO CORTES CASTRO,19.4016791,-99.0721908,
ESCUELA PRIMARIA PROFESOR ELISEO BANDALA HERNANDEZ,19.2915381,-99.2377655,
ESCUELA PRIMARIA PROFESOR EMILIANO NEGRETE LOPEZ,19.3417447,-99.0224473,
ESCUELA PRIMARIA PROFESOR ENRIQUE VÁZQUEZ ISLAS,19.4768139,-99.0711787,
ESCUELA PRIMARIA PROFESOR ERASTO VALLE ALCARAZ,19.3809570,-99.2104040,
ESCUELA PRIMARIA PROFESOR ERNESTO MORENO BELLO,19.5610597,-99.1404970,
ESCUELA PRIMARIA PROFESOR FELIPE LOPEZ,19.3339945,-99.0236888,
ESCUELA PRIMARIA PROFESOR FRANCISCO DE LA MAZA CUADRA,19.4659438,-99.0629394,
ESCUELA PRIMARIA PROFESOR FRANCISCO NAVA BAÑUELOS,19.4959501,-99.1509704,
ESCUELA PRIMARIA PROFESOR GABRIEL LUCIO ARGUELLES,19.3171205,-99.1099045,
ESCUELA PRIMARIA PROFESOR GRACIANO SANCHEZ CCT09DPR1204P,19.3324606,-99.1077002,
ESCUELA PRIMARIA PROFESOR HERMILO ZAVALZA DEL VALLE,19.2751250,-99.2230018,
ESCUELA PRIMARIA PROFESOR JORGE CASAHONDA CASTILLO,19.3460006,-99.1896554,
ESCUELA PRIMARIA PROFESOR JOSE DE JESUS DE LA ROSA PEREZ SOTO,19.3159320,-99.1039468,
ESCUELA PRIMARIA PROFESOR JOSE GANZALEZ VILLASEÑOR,19.3318077,-99.0381283,
ESCUELA PRIMARIA PROFESOR JOSE MA BONILLA,19.4973103,-99.0957413,
